content_id,title,contentType,lang
-8142426490949346304,A identidade visual de Budapeste para as Olimpíadas de 2024,HTML,pt
4548329563501022720,"Inside Capacitor, BigQuery's next-generation columnar storage format | Google Cloud Big Data Blog",HTML,en
-548495338204268800,"Inside Capacitor, BigQuery's next-generation columnar storage format | Google Cloud Big Data Blog",HTML,en
8497861351486449664,"Inside Capacitor, BigQuery's next-generation columnar storage format | Google Cloud Big Data Blog",HTML,en
6754417485681598464,Forget the Cloud - 'The Fog' Is the Next Big Thing | Fox Business,HTML,en
7818691400791322624,Nubank e Goldman fecham parceria de R$ 200 milhões,HTML,pt
-6484638837208285184,"5 awesome Google Keep features you aren't using, but should be",HTML,en
1137471872769164416,Google Calendar for Android can now find meeting times that work for everyone,HTML,en
-7992053163122498560,World's Fastest Growing Open Source Platform Pushes Out New Release,HTML,en
1306706744219888896,Debugging data transformations using Cloud Dataflow and Stackdriver Debugger | Google Cloud Big Data Blog,HTML,en
-3319960804317299200,Enhanced persistent disks for Google Compute Engine = better Kubernetes and Docker support,HTML,en
5913609969272243200,Lessons learned from a year of using live migration in production on Google Cloud,HTML,en
7105108082715965440,Video: Can we save the open web? by Dries Buytaert at SxSW,HTML,en
4437902912817080832,Taming the herd: using Zookeeper and Exhibitor on Google Container Engine,HTML,en
-7908990633460844544,"Google anuncia MODE, pulseiras com tecnologia snap-and-swap para Android Wear | Google Discovery",HTML,pt
408569329455206656,These gloves can convert sign language into spoken English,HTML,en
9091641298512814080,OpenAI,HTML,en
-1852324383183073792,Load Your Steam Wallet Using Bitcoin,HTML,en
3705075652854270464,The Science of Cycology,HTML,en
-1549326815285717760,"Machine Learning, AI, and the Emperor's Vest",HTML,en
2990005046938769408,SpaceX plans to debut Red Dragon with 2018 Mars mission,HTML,en
-1123543351704082432,Xamarin gratuito no Visual Studio (Channel 9),HTML,pt
-4475938295812802560,"Trabalhando com dinheiro no Java, uma visão pragmática da nova money-api",HTML,pt
-3428996085514172416,Facebook at Work pushed to 'later this year',HTML,en
4559158557590109184,Novidades do CDI 2.0,HTML,pt
-662806181534790400,Wells Fargo to Verify Customers through Eye Prints,HTML,en
-1622037268576555520,You won't recognize the new world of digital payments without this report,HTML,en
-1444481301861872384,Nova campanha da Avon tem drag queen como estrela,HTML,pt
4918358495761748992,Saúde de homens gays e bi é foco de nova campanha do governo,HTML,pt
6015995473246774272,The need to lead in data and analytics,HTML,en
-158184760257182656,Plug the Fathom Neural Compute Stick into any USB device to make it smarter,HTML,en
1968587931268137984,Bolinho de Arroz sem Glúten - facílimo de fazer!,HTML,pt
-6726685468116057088,Steak Tartare com Salada Verde,HTML,pt
-5123671543726523392,Google for Work and Google Cloud Platform get new security and privacy certifications,HTML,en
-2990485643677949440,The Secret History of Agile Innovation,HTML,en
-1312850681127865344,Swift.org,HTML,en
-3338916066794638336,Iniciando com o Docker: Criando suas próprias imagens - Tableless,HTML,pt
7540764978459876352,Moovit's new Facebook chatbot for transport proves v0 is not going to be good,HTML,en
5514214996211995648,johnpapa/angular-styleguide,HTML,en
-5411404485622450176,Labyrinth of Lies (2014),HTML,en
-8935051432668167168,The Big Lebowski (1998),HTML,en
-5997023418322622464,Rams (2015),HTML,en
6240076106289530880,Sunset Blvd. (1950),HTML,en
7000840123067724800,Incendies (2010),HTML,en
-3750301395521973248,The Best Offer (2013),HTML,en
-3336755617029300224,Inception (2010),HTML,en
-4761420664091904000,Now playing: New ISO security and privacy certifications for Google Cloud Platform,HTML,en
-6467708104873170944,5 reasons your employees aren't sharing their knowledge,HTML,en
2817960273225808896,Johnson & Johnson compra líder global em dermocosméticos | EXAME.com,HTML,pt
-2766592729910903296,Como é o relacionamento do CMO e do CIO na sua empresa?,HTML,pt
1286723199785027328,The Skills You'll Need and the Salary You Can Expect as a Data Scientist,HTML,en
2280365999288628992,The Best Linux Distros of 2016,HTML,en
1595230810451459840,Event Map For Google I/O 2016 Released,HTML,en
8120046881003899904,Email Isn't The Thing You're Bad At,HTML,en
-4748027149000767488,8 Old School SEO Practices That Are No Longer Effective - Whiteboard Friday,HTML,en
8596997246990922752,This year's Founders' Letter,HTML,en
2793899372921425920,"Google CEO: Mobile will fade, AI will rise",HTML,en
-3850335246895770112,You're Asking Too Much of Chat Bots. Just Let Them Grow Up,HTML,en
-605114438206384896,"A sneak peek at Google's upcoming travel app, Trips",HTML,en
-3820497466351868928,DeepMind moves to TensorFlow,HTML,en
-4187268503708156928,A Single App That'll Wrangle Your Millions of Messengers,HTML,en
-456574518348806208,A Single App That'll Wrangle Your Millions of Messengers,HTML,en
910894669274456960,"Franz - from idea to 10,000 daily active users in 26 days - Meet Franz",HTML,en
4153717385931831296,"Twitter killed Magic Recs, the only useful bot there is",HTML,en
-5756697018315640832,Being A Developer After 40 - Free Code Camp,HTML,en
-2333243857499586560,SIG Combibloc lança campanha para Américas e consolida sua proposta de valor,HTML,pt
-8819557474068526080,Good Software Takes Ten Years. Get Used To it.,HTML,en
-7876497512693688320,The Joel Test: 12 Steps to Better Code,HTML,en
8483892789913825280,Cookbook,HTML,en
-3410781775610271232,Deep Learning Demystified,HTML,en
-5331421579623797760,Microsoft wants to connect all your favorite apps with Flow,HTML,en
-1625815289565836544,Google's OnHub router finally gets some smart home features via IFTTT,HTML,en
-1313614305945895168,Ordering coffee in Italy: the 10 commandments,HTML,en
966067567430037504,To bot or not to bot,HTML,en
5965544132537436160,Kubernetes,HTML,en
-4295420427690447872,To Use Physical Or To Use Virtual: That is the container deployment question,HTML,en
-9002191823887486976,Is the Chatbot Trend One Big Misunderstanding?,HTML,en
-2061825422128752128,The 24 best restaurants in New York City,HTML,en
4911701623098526720,Why image recognition is about to transform business,HTML,en
4089568303716665344,Clippy's Back: The Future of Microsoft Is Chatbots,HTML,en
4843782008053284864,The 200 billion dollar chatbot disruption,HTML,en
-1625217607550912512,Google made a huge change to the way Google Maps look,HTML,en
7273139206342584320,The Hateful Eight (2015),HTML,en
4575580212020245504,Conversational Banking; from branches to bots. - Chatbots Magazine,HTML,en
-3622715112759104512,5 ways to create an environment that helps adults learn to love coding,HTML,en
-7380550029266432000,Extreme Style Machines:Using Random Neural Networks to Generate Textures,HTML,en
7488370990373644288,This motorized wheel adds electric power to your bike,HTML,en
-2430153190648595968,How Android gets to 100% market share,HTML,en
2670715450352290304,"Handling context in ""outside-in""",HTML,en
-4524355549457527296,While doves were crying: this week on Google Cloud Platform,HTML,en
-4754223659064624128,Effective learning through code workshops | Box Blog,HTML,en
-1654063646246197248,Big IT Rising,HTML,en
-1630229587164086272,Dries Buytaert,HTML,en
3168079495368669184,Are Chatbots Really The Future Of Web Design?,HTML,en
8384349834972693504,Python Ecosystem for Machine Learning - Machine Learning Mastery,HTML,en
-5952729859839521792,Investimentos em coaching e mentoring aumentam nas empresas,HTML,pt
7763750328910542848,This Japanese Restaurant Is Decked out With Yakuza-Inspired Tattoo Art | Highsnobiety,HTML,en
3788990922347931648,Google estaria criando aceleradora para seus funcionários - Startupi,HTML,pt
3460026829794172928,TAM recebe primeira aeronave com o design e pintura da LATAM e avança na implantação da nova marca!,HTML,pt
8433131156569129984,"Predicting the future, one week at a time",HTML,en
1318981494172475904,"Google acquires Synergyse, an interactive training service for Google Apps",HTML,en
-2388274433047019008,Scientists discover potentially habitable planets,HTML,en
-7474372733748503552,"Estonia wants to become a 'country as a service' and already has 10,000 virtual residents",HTML,en
7877378240682678272,Qualcomm's deep learning SDK will mean more AI on your smartphone,HTML,en
5843350704442714112,The 7 Habits of a Highly Effective Product Owner,HTML,en
6876740810766965760,Qualcomm Snapdragon 820 Deep Learning SDK Nudges Local Neural Nets Closer To Mainstream,HTML,en
6980529106338479104,Why The New Chatbot Invasion Is So Different From Its Predecessors,HTML,en
-730957269757756544,Por que a limitação da banda larga é uma forma de ignorar o futuro,HTML,pt
-6878119266243511296,"Google acquires Synergyse, an interactive training service for Google Apps",HTML,en
-6457517220721978,Agronegócio mantém crescimento com tecnologia - inova.jor,HTML,pt
-3968102273907750912,Adaptation. (2002),HTML,en
-74919696966767904,Being John Malkovich (1999),HTML,en
-7814257818245609472,Magnolia (1999),HTML,en
3456446200772320768,Eternal Sunshine of the Spotless Mind (2004),HTML,en
7569814035922104320,Once Upon a Time in the West (1968),HTML,en
6569723785655740416,Let the Right One In (2008),HTML,en
614512039577184128,"4 Months, 3 Weeks and 2 Days (2007)",HTML,en
6296126022971270144,Downfall (2004),HTML,en
-504935756748713152,Boogie Nights (1997),HTML,en
-5289386635926629376,Punch-Drunk Love (2002),HTML,en
3687286164936909824,Pi (1998),HTML,en
3702150017806960128,Requiem for a Dream (2000),HTML,en
-6016433871633245184,The Fountain (2006),HTML,en
9168028029170358272,"The Cook, the Thief, His Wife & Her Lover (1989)",HTML,en
-7684863035595644928,Wings of Desire (1987),HTML,en
34557439830244256,Sympathy for Lady Vengeance (2005),HTML,en
6258766779968999424,Sympathy for Mr. Vengeance (2002),HTML,en
-5345231991504930816,Oldboy (2003),HTML,en
-6056382045660082176,Melancholia (2011),HTML,en
-4882849408937990144,Dogville (2003),HTML,en
-894273917655637632,Departures (2008),HTML,en
-5678159351655490560,Roupas com Wifi e GPS? Desenvolvedor une tecnologia com o universo têxtil - Startupi,HTML,pt
4739732607073456128,Departures (2008),HTML,en
-8112397019636931584,Departures (2008),HTML,en
7078276984547732480,How Companies Are Using Machine Learning to Get Faster and More Efficient,HTML,en
8589361101754365952,Acesse a versão Material Design do YouTube | Google Discovery,HTML,pt
-7714713652743527424,Conheça a patente do Google que prevê entregas por drones - Startupi,HTML,pt
4139191914110236160,An operating model for company-wide agile development,HTML,en
-703416562539077120,Scrum Community - Scrum Alliance,HTML,en
-1706114177222872576,The Spotify Tribe,HTML,en
7606744605433798656,Why the customer experience matters,HTML,en
2672238531812965376,Improving Angular performance with 1 line of code,HTML,en
-6603351162010420224,VersionOne AgilelIVE™ Webinar Series| SAFe® Expert Webinar,HTML,en
-1981734999963962368,Google's Cloud Dataflow stomps on Apache Spark in new benchmark tests,HTML,en
3375733407275108864,Brazilian Government and Ericsson to innovate together for Internet of Things,HTML,en
372648779227126656,Planned Death,HTML,en
-5820943153819993088,Google : End Of The Online Advertising Bubble,HTML,en
4917926779066818560,Hidden (Caché) (2005),HTML,en
5232169374213306368,Mulholland Drive (2001),HTML,en
-614408900691920896,X-Men | São Paulo vai receber exposição sobre filmes da saga,HTML,pt
3801064060797809152,How Green Was My Valley (1941),HTML,en
-8686523832043452416,All About Eve (1950),HTML,en
1107739178195154688,Peças Translúcidas,HTML,pt
-5444306124868253696,Por que os CEOs devem apostar grande no digital (ou voltar pra casa) - CIO,HTML,pt
-7564053678326007808,Chatbots for work: Troops raises $2.6M to help you use Salesforce,HTML,en
5508665170385092608,IBM Is Now Letting Anyone Play With Its Quantum Computer,HTML,en
4544213501105458176,How I got into the top 15 of a Kaggle competition in 3 days: A Python Tutorial,HTML,en
914293752636521856,Asia's mobile-first economy and how the West is feeling the effects,HTML,en
6369367631770967040,Como a Netflix influencia o que você vai assistir através de imagens,HTML,pt
1738052593226421760,Como resolver conflitos no ambiente corporativo us,HTML,pt
-1338957937839941376,Qual é o país mais inovador do mundo?,HTML,pt
7255021292858609664,An operating model for company-wide agile development,HTML,en
2491414153837906432,A Royal Affair (2012),HTML,en
1719976830095479808,Bicycle Thieves (1948),HTML,en
-6275771337261602816,Nights of Cabiria (1957),HTML,en
764116021156146816,"If you think women in tech is just a pipeline problem, you haven't been paying attention - Tech Diversity Files",HTML,en
7572869304086387712,The White House Has Realized Artificial Intelligence Is Very Important,HTML,en
-4944551138301474816,Algorithms and architecture for job recommendations,HTML,en
-5579492244806284288,"[Tools] Personal Kanban in ""Favro""",HTML,en
49177526672934032,After a year of using NodeJS in production,HTML,en
-6324550271415245824,4 Strategies for Mastering UX in Virtual Reality Games,HTML,en
300937643051923200,Mimo baby monitor helps parents get more sleep,HTML,en
-9055044275358687232,Accept questions from your audience when presenting in Google Slides,HTML,en
3980405883168341504,"Apple, Set to Move to Its Spaceship, Should Try More Moonshots",HTML,en
-2208293144000550912,Docker Cleanup Scripts Comparison,HTML,en
6424668376409530368,Docker inside docker and overview about Jenkins 2,HTML,en
-8949113594875411456,"No Brasil, '25% dos celulares ainda são 'Burrofones'",HTML,pt
2589533162305407488,6 reasons why I like KeystoneML,HTML,en
3751305746867503616,A reunião secreta em que Wall Street testou dinheiro digital | EXAME.com,HTML,pt
6535950170823528448,"Google Slides incorpora recurso de ""perguntas e respostas"" em tempo real | Google Discovery",HTML,pt
-3234984575507976192,MasterTech - Como ter um bom relacionamento com a Escrita,HTML,pt
-3348458175249982464,Teori afasta Eduardo Cunha do mandato na Câmara,HTML,pt
-655909700262679296,Banco desafia empreendedores e estudantes de tecnologia a buscarem inovação para processos | EXAME.com,HTML,pt
-8700857105739860992,"Forget Wallets, Check out This Serious FinTech Product Built in India: ZestMoney for Instant Credit",HTML,en
9220445660318725120,Angular 2,HTML,en
1024145536490998528,Porto Seguro compra carteira de seguros Auto da Chubb,HTML,pt
-7891960098457323520,"Dag Kittlaus, co-founder of Siri, will give the world's first demo of a next gen AI called Viv at Disrupt NY",HTML,en
-1852234953549915392,The Color of Paradise (1999),HTML,en
-8041742992841055232,Enemy (2013),HTML,en
3720742491238027776,29 Common Google Analytics Data Errors And How To Fix Them,HTML,en
-5570129644089964544,Design Kit: Prototyping,HTML,en
459008865413659392,Unimart Shopping Campinas e Tetra Pak realizam Circuito da Reciclagem,HTML,pt
1433951803438448384,"Creative partnerships: Machine learning and the future of design - O'Reilly Media Free, Live Events",HTML,en
541470630329465152,"Chatbots Are Your Newest, Dumbest Co-Workers",HTML,en
-6157984812065160192,"""Empresas inovadoras não fazem produtos - constroem conceitos que se tornam experiências irresistíveis""",HTML,pt
2032007496318617088,Cientistas trabalham em técnica que permite imprimir alimentos,HTML,pt
6234756865145917440,Suzana Herculano-Houzel deixa o Brasil e expõe problemas profundos da ciência no país,HTML,pt
1556878199027930368,TAM recebe primeira aeronave com o design e pintura da LATAM e avança na implantação da nova marca!,HTML,pt
1698483880714927616,"Google's AI engine is reading 2,865 romance novels to be more conversational",HTML,en
-6542996094878850048,How One Jira Ticket Made My Employer $1MM/Month: 7 Metrics that Actually Matter - JavaScript Scene,HTML,en
-3875881534863988736,Visa lança desafio para startups de tecnologia - Startupi,HTML,pt
909703879562824192,"YouTube pode lançar serviço de televisão online ""Unplugged"" em 2017 | Google Discovery",HTML,pt
5051167660880460800,Google Cloud and Autodesk enable 10x improvement in media rendering efficiency,HTML,en
8295457724580096000,The Startup Zeitgeist,HTML,en
3608243634452079104,"Carne artificial acabará com o agronegócio brasileiro, afirma especialista",HTML,pt
-8510490754427841536,How a Chatbot Helped This Vinyl Records Startup Make $1 Million in 8 Months,HTML,en
-8722526817358894080,VR possibilities at Google I/O 2016: Four things I'm hoping to see,HTML,en
5165953265902526464,Zoneamento Agrícola - MAPA,HTML,pt
6910763794618680320,JavaServer Faces 2.3 Quick Reference - DZone Java,HTML,en
6754313450809254912,Five priorities for competing in an era of digital globalization,HTML,en
4625350031392752640,Google connects BigQuery to Google Drive and Sheets,HTML,en
5037221949349730304,Susan Wojcicki on the Effectiveness of Empowering Ads on YouTube,HTML,en
-7959318068735027200,Auto-scaling scikit-learn with Spark,HTML,en
163780025692404864,The SFMOMA's New App Will Forever Change How You Enjoy Museums,HTML,en
321193326651975872,Quando a ignorância vence a solidariedade,HTML,pt
-229081393244987776,Building AI Is Hard-So Facebook Is Building AI That Builds AI,HTML,en
-1901742495252324864,Designing smart notifications,HTML,en
2457939609972623360,Nashorn: JavaScript made great in Java 8,HTML,en
-2247142819145310976,Stetho for Android debug builds only,HTML,en
-1492574794514500096,Programming by poking: why MIT stopped teaching SICP,HTML,en
8316918063034631168,"Inside Palantir, Silicon Valley's Most Secretive Company",HTML,en
-5297634649735764992,Google is quietly making progress on one of its most jaw-dropping tech projects,HTML,en
-1917202688559171840,The next AI is no AI,HTML,en
-1088742830039453696,The next stop on the road to revolution is ambient intelligence,HTML,en
-8279505492976428032,"Bots, Messenger and the future of customer service",HTML,en
7124632953201847296,Inside the offices of New York's biggest startups,HTML,en
-4127059794203206144,TPOT: A Python tool for automating data science,HTML,en
-6369211973034956800,Getting Started with Activity & Fragment Transitions (part 1),HTML,en
-5522643017727334400,Introducing the Startup Battlefield companies of Disrupt NY 2016,HTML,en
-8615957592921856000,Shutter Island (2010),HTML,en
-5602127731550819328,The Top 10 Most Common Mistakes That Node.js Developers Make,HTML,en
8049667463017473024,"Miracles of Human Language: An Introduction to Linguistics - Universiteit Leiden, Meertens instituut (KNAW) | Coursera",HTML,en
5979676385148715008,"Here's what Viv looks like, the next generation AI assistant built by Siri creator",HTML,en
-5037827401452846080,Quando o Scrum irá falhar - Tableless,HTML,pt
4716135688735489024,"No dia das mães, Avon lança campanha com mãe de jovem gay",HTML,pt
-205193648629294848,Is FinTech Forcing Banking to a Tipping Point?,HTML,en
7516228655554310144,A digital crack in banking's business model,HTML,en
5468598741732935680,35 Innovative and Inspirational Website Designs in Banking,HTML,en
10247031220756478,[Tools] 12 Apps for Live-streaming Video,HTML,en
-4615179238096674816,"Sua empresa já tem um ""Open Innovation Lab"" ? - CIO",HTML,pt
6237433897543964672,"Facebook details its company-wide machine learning platform, FBLearner Flow",HTML,en
-5024561776910686208,How Airbnb uses Machine Learning to Detect Host Preferences - Airbnb Engineering & Data Science,HTML,en
-724699218170106880,Tensorflow wins,HTML,en
2917561522815946752,Behold.ai launches artificially intelligent medical software to find abnormalities faster,HTML,en
357449794379078656,Apple anuncia a 3ª geração da linguagem Swift para o final deste ano,HTML,pt
4629488036162962432,"Para rebater Estatuto da Família, campanha muda significado de 'família' no Dicionário Houaiss",HTML,pt
1954074927376897280,"Swarm A.I. Correctly Predicts the Kentucky Derby, Accurately Picking all Four Horses of the Superfecta at 540 to 1 Odds",HTML,en
-2118981143119783424,What readers think about computer-generated texts,HTML,en
8689098216946253824,"Facebook says 10K+ developers are building chatbots, analytics coming",HTML,en
-3169423801125605376,Amazon has a huge opportunity in grocery delivery,HTML,en
279771472506428960,5 Unique Features Of Google Compute Engine That No IaaS Provider Could Match,HTML,en
-277169424764188800,Introducing Sign in with Slack - Slack Platform Blog,HTML,en
-4049108709890216960,Stay focused with Google Calendar event notifications in your browser,HTML,en
3149164017776669696,Mobile marketing statistics 2016,HTML,en
3241240229241793536,Startup usa algoritmo e rede social para aprovar empréstimos | EXAME.com,HTML,pt
-329139582593571072,Itaú prevê aumentar escala da ConectCar,HTML,pt
7938100642081251328,What SWAG will Google I/O 2016 attendees take home?,HTML,en
1805849336099641600,Google I/O 2016 Preview: A Chrome/Android merger? Project Tango? VR?,HTML,en
7664140604181040128,Will blockchain drive the fourth Industrial Revolution?,HTML,en
7187974705675832320,Largest IoT Event Kicks Off at Santa Clara Convention Center,HTML,en
2072448887839540992,"Welcome to GoogleBank, Facebook Bank, Amazon Bank, and Apple Bank - Enrique Dans",HTML,en
-4975645025178553344,Sem Parar vs Conectcar - DanBP.org,HTML,pt
-8085935119790093312,Graph Capabilities with the Elastic Stack,HTML,en
-749116597676471808,Introducing unlimited private repositories,HTML,en
4045164454094417408,1º Congresso Brasileiro de IoT - Embarcados,HTML,pt
2518704978033827328,Google Now Posting Full OTA Images For Nexus Devices Alongside Factory Images,HTML,en
-7673844339521298432,WhatsApp just released desktop apps for Mac and Windows,HTML,en
-7485130558326481920,Ozlo The AI Chatbot Wants To Help You Find Coffee And Food,HTML,en
6198232071580299264,Empresas intensificam operações de barter diante da dificuldade de crédito,HTML,pt
3643465492984939520,Production Ready Jenkins 2.0 in Two Steps with Docker,HTML,en
7359386552064322560,E os vencedores do Latam Founders Awards 2016 são... - Startupi,HTML,pt
1019706997674210688,Assista a entrevista de Linus Torvalds no TED legendada,HTML,pt
-8278633353687754752,3Dprintler lets you order a 3D print via chatbot,HTML,en
8402348887626635264,From E-Commerce to Web 3.0: Let the Bots Do the Shopping,HTML,en
5439554346835640320,"Consórcio: Venda de novas cotas cai 13,5% no 1º trimestre",HTML,pt
-6255454949363032064,From Insight-as-a-Service to insightful applications,HTML,en
-1820269894165785344,3M e o perfil intraempreendedor | Endeavor Brasil,HTML,pt
833256912680066560,"Rumor: ""Android VR"" Will Launch At I/O With Standalone Headset, Reference Appears In Unreal Engine",HTML,en
-5464698687596686336,IBM's Watson aims to make hospital stays suck a whole lot less,HTML,en
4563606877148406784,YouTube's New Messenger Means You'll Never Have to Leave YouTube,HTML,en
-6792965795755857920,Dial in with ease using the latest Google Calendar app for Android,HTML,en
-7452761262757182464,Baião de Dois - uma delicia brasileiríssima,HTML,pt
8021508382912212992,Bolinho de parmesão,HTML,pt
-8222568914848294912,What Millennials Want from a New Job,HTML,en
3845974592165897728,Good to Great,HTML,en
4899554125167253504,The Real Lesson for Data Science That is Demonstrated by Palantir's Struggles,HTML,en
-4068545238978420224,Making Apache Spark Easier to Use in Java with Java 8 - Cloudera Engineering Blog,HTML,en
7288937801410681856,The Gold Mine: A Novel of Lean Turnaround,HTML,en
4069333494579100160,"Agile is Dead, Long Live Continuous Delivery - Gradle",HTML,en
1331356827163029248,Dilma regula Marco Civil e acaba com WhatsApp e Facebook grátis no celular,HTML,pt
-5941854046477982720,Google lança teclado virtual para iPhone com recursos de pesquisa | Google Discovery,HTML,pt
5568089143939945472,"The future of machine learning: 5 trends to watch around algorithms, cloud, IoT, and big data - GeekWire",HTML,en
5109221095427624960,Robôs (bots) serão tão populares quanto apps; entenda a nova tendência,HTML,pt
9033884391004475392,The Art of the OKR,HTML,en
4315784099325221888,tins ::: Rick Klau's weblog,HTML,en
-3114161754347804160,How Google sets goals: OKRs - GV Library,HTML,en
5268351851132250,The bizarre beasts living in Romania's poison cave,HTML,en
4463025528374352384,The Blockchain is the new Google,HTML,en
-3980612444042641408,The future of SaaS hosted git repository pricing,HTML,en
-4050006690189978112,Announcing SyntaxNet: The World's Most Accurate Parser Goes Open Source,HTML,en
8938071859536254976,Design Sprint: onde o design e a velocidade importam,HTML,pt
2916072977192006144,Confused by blockchains? Revolution vs Evolution,HTML,en
2704671778746002944,Report: Google I/O to focus on voice search as Google preps 'Chirp' competitor to Amazon Echo,HTML,en
5719793245136119808,Cade autoriza Itaú Unibanco e Mastercard a criarem nova bandeira de cartão,HTML,pt
-3954182109690207232,Google Cloud Goes to the Farm,HTML,en
626121253933491456,Amazon just released a Dash button for AWS IoT,HTML,en
-2097626568191556352,Google releases keyboard for the iPhone with built-in search features,HTML,en
-9128652074338368512,Clarifying the uses of artificial intelligence in the enterprise,HTML,en
5088013394045186048,JavaScript Conquered the Web. Now It's Taking Over the Desktop,HTML,en
2470587255066232320,University of Washington partners with Disney to develop cheap touch-sensitive paper - GeekWire,HTML,en
3746463631389880320,Adobe quer potencializar área de marketing digital - Meio & Mensagem,HTML,pt
-8044741783031985152,It's coming! The Internet of Eyes will allow objects to see,HTML,en
3017826600888052736,Quip now connects with Slack to help teams kick more butt across the globe,HTML,en
