content_id,title,contentType,lang
4891164246772480000,Motion with Meaning: Semantic Animation in Interface Design,HTML,en
4404314996867098624,Building an Angular 2 Application for Production,HTML,en
784265334245910656,My Top 9 Favorite Python Deep Learning Libraries - PyImageSearch,HTML,en
5795281877636738048,Microsoft's Open Source Love Affair Reaches New Heights,HTML,en
-2547386150711651840,TensorFlow v0.9 now available with improved mobile support,HTML,en
3205047378909988864,Java vs .NET vs Python vs Ruby vs Node.JS: Who Reigns the Job Market? | Takipi Blog,HTML,en
2495913984359439360,Android Mobile Vision restores operation and adds Text API | Android Developers Blog,HTML,en
-6592496241044177920,"Create Intelligent, Context-Aware Apps with the Google Awareness APIs | Android Developers Blog",HTML,en
4894833130708450304,Um misterioso vórtice escuro surgiu sobre Netuno,HTML,pt
3823268327704412672,"Facebook Enhances Everyone's Like With Love, Haha, Wow, Sad, Angry Buttons",HTML,en
1179326165172129792,Matemáticos descobrem um padrão inesperado nos números primos,HTML,pt
-6820241302436968448,Goodbye accountants! Startup builds AI to automate all your accounting,HTML,en
-5002383425685129216,Changing change management,HTML,en
1796618361228441856,"Fresco, sim! - Android Dev BR",HTML,pt
8926889915100215296,A new sales technology stack is coming,HTML,en
2668385070649954816,"Walgreens now lets you digitally clip coupons from its iOS app, redeem in-store through Apple Pay with loyalty card",HTML,en
-2549933363319068672,The real reasons you procrastinate - and how to stop,HTML,en
-2539915991213675520,Brazil's Banco Bradesco Joins R3 Consortium - CoinDesk,HTML,en
7521700660190108672,Como são escrita as risadas em japonês? - Suki Desu,HTML,pt
408283689595887488,This New Banking AI Is the Here and Now of Chatbots,HTML,en
8857442213860272128,Lista mostra os sites de compras mais procurados pelos brasileiros. Confira,HTML,pt
-3612149709424815104,Netshoes é grande vencedora do Prêmio BR Week 2016,HTML,pt
-592655813177747840,"Cozmo Is the Smartest, Cutest AI-Powered Robot You've Ever Seen",HTML,en
430255078684584576,Google researchers teach AIs to see the important parts of images - and tell you about them,HTML,en
-3946932055798267904,Google+ is five years old today,HTML,en
-7509877147979460608,Como ser menos ocupado em um mundo ocupado,HTML,pt
489290927107045568,Research: Why Best Practices Don't Translate Across Cultures,HTML,en
1181375551449952000,Using analytics to turbocharge China's e-commerce performance,HTML,en
-1672165618620086272,Planejamento Estratégico Pessoal | Endeavor Brasil,HTML,pt
-1199490911632552960,Our password hashing has no clothes,HTML,en
6620060201676471296,Creating Compound Views on Android,HTML,en
3075564241645350400,Decentralizing IoT networks through blockchain,HTML,en
-1557461511205521664,"Millennials Don't Care About Owning Cars, And Car Makers Can't Figure Out Why",HTML,en
8901449108040307712,Monitoramento em tempo real com Elasticsearch e Kibana,HTML,pt
-5833012379380837376,Rakuten é premiada como melhor plataforma de e-commerce do varejo brasileiro,HTML,pt
7155061818771055616,Wide & Deep Learning: Better Together with TensorFlow,HTML,en
2819427195737975296,Facebook Thinks It Has Found the Secret to Making Bots Less Dumb,HTML,en
2645380860642118656,'We've realized a ten-year strategy goal in one year',HTML,en
-8026099268928088064,Plataforma anuncia integração com marketplace líder em artigos esportivos,HTML,pt
-7862677531530632192,11 incredible ways UK businesses are using chatbots,HTML,en
4783081874753928192,DevOps,HTML,pt
-2131823791227094784,Descubra os 10 apps mais importantes para o brasileiro,HTML,pt
4485571547865864704,Bose's New Speaker Only Costs $150 But You Have to Build It Yourself,HTML,en
4235212484048164352,Coca-cola traz ao Brasil sabores cereja e baunilha,HTML,pt
-667193404227875712,The Drive to Bank on Digital,HTML,en
2625883933130361344,Making open source data more available,HTML,en
-6727357771678896128,This Super Accurate Portrait Selection Tech Uses Neural Networks,HTML,en
-5014627593450767360,Drupal and ambitious digital experiences,HTML,en
-2828628091730682368,Serverless Architectures,HTML,en
7544768317373280256,Google adiciona medidor de velocidade da internet nos resultados de pesquisa | Google Discovery,HTML,pt
-8277924497842156544,GitHub on BigQuery: Analyze all the open source code,HTML,en
2267321579404324864,Migrating from Parse to Bluemix,HTML,en
4383035933260676608,"Pedágio das rodovias estaduais de SP sobe 9,32% na sexta-feira - O Liberal",HTML,pt
8814787788150050816,Learn Japanese Online | Japanese Podcast| JapaneseLingQ.com,HTML,en
7238948407563080704,"Meet Articoolo, the robot writer with content for brains",HTML,en
-1124738136890721024,A Baseline for Hybrid Mobile Developers,HTML,en
-3110580810771259392,Webinar do AEM para ajuda na preparação para fazer a prova de certificação.,HTML,en
2607211459879791616,Leveling Up Your JavaScript -,HTML,en
2080544143997420800,Pneus que andam de lado podem ser instalados em qualquer carro,HTML,pt
3825866166263569920,Piloto de caça criado por inteligência artificial vence humano em combate simulado,HTML,pt
4861691621484862464,Diversidade no Brasil: um longo caminho a percorrer,HTML,pt
-2136400115854451456,One year as a Data Scientist at Stack Overflow,HTML,en
-2577148567706202624,Julia Galef: Why you think you're right -- even if you're wrong,VIDEO,en
-4037032837327175680,Blaise Agüera y Arcas: How computers are learning to be creative,VIDEO,en
7851022564818849792,Workplace diversity in Brazil: there's still a long way to go,HTML,en
2323403245382926848,Final is a plaster on the gaping wound that is U.S. credit card security,HTML,en
-5255285107284514816,Como a Microsoft está trabalhando com o conceito de IoT - Startupi,HTML,pt
4320282974712265216,The future of agriculture - Jim Womack visits a lean farm,HTML,en
270443693434886112,MOBILE TIME - Drones vão ajudar pequenos agricultores no Brasil,HTML,pt
-4570752586662989824,End is nigh for Rosetta,HTML,en
-6245566021053602816,Google lança YouTube Kids no Brasil | Google Discovery,HTML,pt
5445999759138709504,Bradesco lança serviço inédito para estimular o hábito de poupar,HTML,pt
7434270606888620032,Stackdriver Debugger now works with source code directly in GitHub and Bitbucket,HTML,en
4991224059205502976,Evaluating the security of Drupal contrib modules,HTML,en
-595851741330881152,The Risks and Rewards of Fully Decoupling Drupal | Acquia,HTML,en
9128267824356972544,What Bazaars Can Teach Us About Digital Marketplaces,HTML,en
-6546787050052580352,Debug Site Performance Using Web Profiler in Drupal 8,HTML,en
-4239579488204604928,Announcing pricing for Google Stackdriver,HTML,en
-3404981437157985792,BigQuery goes wide: this week on Google Cloud Platform,HTML,en
4372031182493802496,Creating a scalable API with microservices,HTML,en
-6765871608738224128,10 Simple Habits of Insanely Productive People,HTML,en
-8312968399134741504,How AWS came to be,HTML,en
4396754138692995584,"Com compra da Estácio, Kroton se torna ""inalcançável"" | EXAME.com",HTML,pt
-8796191278504624128,Object calisthenics: Change the way you code,HTML,en
-7169261479876586496,Carteira inteligente tem trava biométrica e controle por aplicativo - Gadgets,HTML,pt
190366396794861216,Demolition (2015),HTML,en
-7990179956144740352,Accenture Launches Content Studio,HTML,en
4609121753781446656,"Lava-louças Brastemp Ative! 8 Serviços Blf08abana 110v - R$ 800,00",HTML,pt
-2306089797938257408,"Sony Playstation 3 Fat 160gb - R$ 720,00",HTML,pt
-5020541944663390208,"We are 'almost definitely' living in a Matrix-style simulation, claims Elon Musk",HTML,en
-7371144664961015808,"Big data, big bandwidth: this week on Google Cloud Platform",HTML,en
1158279435862414336,Via Varejo investe R$ 13 mi em dois novos centros de distribuição e entreposto - ISTOÉ Independente,HTML,pt
2436112252908442624,[Webinar] API RESTful Mercado Livre,HTML,pt
365571143597993920,Power to the People: How One Unknown Group of Researchers Holds the Key to Using AI to Solve Real...,HTML,en
5092635400707339264,Power to the People: How One Unknown Group of Researchers Holds the Key to Using AI to Solve Real...,HTML,en
-9190737901804729344,The Real Product Market Fit,HTML,en
4402253552023115264,Introduction to Guitar - Berklee | Coursera,HTML,en
476793294516827072,[Podcast] Visa: de olho no futuro do mercado financeiro [CT Entrevista],HTML,en
-9216926795620866048,Request lesson : How and when to use はず(=hazu) | Maggie Sensei,HTML,la
-6096307037126839296,How to scale yourself: the '99/50/1' framework - The Mission,HTML,en
-4460374799273064448,"Deep Learning for Chatbots, Part 1 - Introduction",HTML,en
-3662111110237135360,"Deep Learning for Chatbots, Part 2 - Implementing a Retrieval-Based Model in Tensorflow",HTML,en
-7925445844362297344,ASIAN INNOVATION FRENZY | New Asia Trend Briefing from TrendWatching,HTML,en
-4262964715347041280,Corporate Intrapreneur Summit,HTML,en
-5000193502203199488,The Business Case for Continuous Delivery | Continuous Delivery | Atlassian,HTML,en
2966083692047828992,Test Driven Development by Example: Validation in Java,HTML,en
-969155230116728832,Learn Hiragana: The Ultimate Guide,HTML,en
-7639185658532886528,Migrating to the New Java 8 Date Time API | Baeldung,HTML,en
6614704926858203136,Introduction to Spring REST Docs | Baeldung,HTML,en
-3854488592949786112,Family photo sharing platform Togethera shutters after low growth numbers,HTML,en
7963184191158282240,Johnson & Johnson Targets 85% of Apps in Cloud by 2018,HTML,en
-2639327025262198272,[Coaching] O que faz o OKR funcionar?,HTML,pt
738761744030347904,How to Install and Use the Linux Bash Shell on Windows 10,HTML,en
-8343581376353287168,Amazon passa Google como ponto de partida para buscas de e-commerce - IDG Now!,HTML,pt
2822049545552366080,2 terrific #MarTech talks on the rise of AI in marketing - Chief Marketing Technologist,HTML,en
-5912792039759735808,Five questions boards should ask about IT in a digital world,HTML,en
-3614882924009373184,Yasuda Marítima muda nome para Sompo Seguros S.A. e conclui alinhamento com Grupo global,HTML,pt
638282658987724800,Machine Learning for Designers,HTML,en
-4657414671719963648,GRI Magazine 4ª Edição,RICH,pt
-2141497471886086400,"Globo.com Uses NGINX for Streaming Media to 500,000+ Viewers",HTML,en
4757923412035174400,Mobile Time,HTML,pt
8413971365124666368,"Building Chatbots with Node.js - Online Training - July 13 & 14, 2016",HTML,en
-8239286201029609472,Serious Business: Is The Sharing Economy Good For Business?,HTML,en
3180828616327439360,Governo define cronograma para plano nacional de Internet das Coisas,HTML,pt
-133139342397538864,"Novo workaholic trabalha, pratica esportes e tem tempo para a família. Conheça",HTML,pt
-6238628334008321024,8 Books Stanford MBAs Recommend You Read This Summer,HTML,en
-6651333707067617280,Ceviche de Salmão com Maracujá,HTML,pt
5338677278233757696,How to Get a Job at Google,HTML,en
-8187220755213888512,Organizing for digital acceleration: Making a two-speed IT operating model work,HTML,en
3097721536109455360,Google buys machine learning startup Moodstock to help your phone's camera identify objects,HTML,en
-6641749235744757760,AirBnB só decolou depois de jogar uma regra de ouro fora,HTML,pt
-8635809464649679872,A inovação que todos queriam: fone de ouvido que traduz outras línguas,HTML,pt
6016376495317031936,Uma recepção eficiente,HTML,pt
-4921088466135297024,What the JIT!? Anatomy of the OpenJDK HotSpot VM,HTML,en
4317140528951861760,Key trends in machine learning and AI,HTML,en
1403599387299755008,"Stream processing, Event sourcing, Reactive, CEP... and making sense of it all",HTML,en
4307433444610636288,SQL vs NoSQL: you do want to have a relational storage by default - Enterprise Craftsmanship,HTML,en
-8368414190009234432,[Course] Gamification - University of Pennsylvania | Coursera,HTML,en
4807410384082534400,Neoliberalismo a ideologia na raiz de todos os nossos problemas,HTML,pt
-645584250289067264,I'm trying my hardest to slow the fuck down - HI MY NAME IS JON,HTML,en
3880098804615439872,Frequently asked questions about design sprints - InVision Blog,HTML,en
-4336355219396420096,Game Of Thrones e suas lições de liderança | Endeavor Brasil,HTML,pt
6352416307575007232,The Home Of The Internet Of Things: Everywhere,HTML,en
1038118700785242112,Community,HTML,en
30461094217357732,Kubernetes 1.3 on tap for Google Container Engine,HTML,en
2203293143157288192,"Por falta de seguro, Alex e Marquinhos não participam de treino da seleção",HTML,pt
1515492713000932864,What the future will look like when we use chatbots instead of apps,HTML,en
-8908991577172785152,"Bots need a personality, not a brain like a vending machine",HTML,en
-4541461982704074240,Exclusive: Why Microsoft is betting its future on AI,HTML,en
-3105075547863520256,Peter Doig sued for disavowing 40-year-old painting,HTML,en
-306538960798971008,Trends in Version Control Land: Innersourcing,HTML,en
-8937070974333044736,Adopting Open Source Development Processes in Corporate IT,HTML,en
358192030955601344,A nova sede da LEGO na Dinamarca é toda sobre colaboração,HTML,pt
-8854146354650100736,"Within a Decade, Retail Banks will be Dead",HTML,la
-4318248821095057408,Gmail API: New endpoints for settings,HTML,en
-5879360586463363072,Introducing LambCI - a serverless build system,HTML,en
-8167536150098135040,Mycroft: The open source answer to natural language platforms,HTML,en
-7124339858992523264,How Etsy Does Continuous Integration for Mobile Apps,HTML,en
-907419983362132480,Continuous Integration for Mobile Apps,HTML,en
-8739701156093513728,The Lifecycle of a Pod,HTML,en
9079880752026843136,Design Better Forms - uxdesign.cc - User Experience Design,HTML,en
-2377881752614744576,Certeza que devemos marcar uma reunião?,HTML,en
8881733945001664512,Configuring OSGi,HTML,en
-2476100034099959296,[Retro] Celebration Grids - Management 3.0,HTML,en
3301147467076955136,The Developer's Midlife Crisis: What's Next?,HTML,en
-7627277742224640000,Pequeno guia para entender as línguas de sinais,HTML,pt
5447580952505295872,"'Uber do ônibus' derruba custo e acaba com engarrafamento, aponta estudo",HTML,pt
5227822864949116928,The Difference Between Sympathy And Empathy - Expanded Consciousness,HTML,en
2424381466524517376,Microsoft and University of Washington researchers set record for DNA storage - Next at Microsoft,HTML,en
8828175072897142784,"The code that took America to the moon was just published to GitHub, and it's like a 1960s time capsule",HTML,en
-170687954910264224,As compras e os hábitos dos brasileiros no shopping | EXAME.com,HTML,pt
-6074661548047199232,Referências para Estudo - Xamarin,HTML,pt
-3964583697784528384,Caravel: Airbnb's data exploration platform - Airbnb Engineering & Data Science,HTML,en
7004101889471761408,Still a virtual reality skeptic? Here's why you shouldn't be,HTML,en
-8460222552900598784,"Gerdau realiza seu primeiro Hackathon, com pegadinha",HTML,pt
-3102446808559724032,Visa e Swatch lançam relógio para pagamentos contactless no Brasil - Startupi,HTML,pt
-1297580205670251264,A minha viagem à Maternidade #tetodomundo,HTML,pt
-1242702988593021440,PHP 7 Support in PhpStorm 2016.2,HTML,en
-6875247493073242112,LATIN INNOVATION BONANZA | New South & Central America Trend Briefing from TrendWatching,HTML,en
-1383778823073811712,Swatch lança relógio para pagamentos em parceria com Visa | EXAME.com,HTML,pt
5045927063019110400,Amazon causa polêmica com serviço que faz entregas em 1 hora em Paris,HTML,pt
-7406587779348496384,[Bonito] Flutuações em Bonito: escolha a sua!,HTML,pt
3884256359744615936,"So, You Want A Table, Huh?",HTML,en
2864534935028964352,50 palestras online e gratuitas para você acompanhar em agosto,HTML,pt
3310859214930485248,"Em Paris, livraria troca estoque por máquina que imprime obras na hora",HTML,pt
1688185960300227584,Infográfico | O que você precisa saber sobre bitcoin - Aletp,HTML,pt
4184543400419595776,Este site quer conectar profissionais trans e travestis a empresas que não têm preconceito,HTML,pt
1356221992133852928,The brilliant mechanics of Pokémon Go,HTML,en
-1537223691132357376,A arte de encantar clientes: 5 lições que aprendemos com a Disney ,HTML,pt
-8043889175123948544,Dicas avançadas de ruby (capybara/cucumber),HTML,pt
2623290164732957696,Creative Applications of Deep Learning with TensorFlow | Kadenze,HTML,en
-6817174660103550976,Cafeteria compra item de Pokémon Go para aumentar movimento - e funciona,HTML,pt
-8031358134051917824,Learn Microservices in Java - DZone - Refcardz,HTML,en
2262656830196923904,"Tabs vs Spaces: How They Write Java at Google, Twitter, Mozilla and Pied Piper | Takipi Blog",HTML,en
-1419343869401004288,O deslize da Pepsi ajudou a Pizza Hut e KFC,HTML,pt
-4216050818952952320,Google acquires deep search engine Kifi to enhance its Spaces group chat app,HTML,en
-5039153034159656960,Mercado de Cosméticos no Brasil - Setor que não conhece crise!,HTML,pt
5271898714958115840,This Tiny Robot Lets You Play God With Huge AI,HTML,en
8559816910657872896,Google cloud boss Diane Greene: We're winning against AWS and Microsoft,HTML,en
4375556914674736640,Código Google: Introdução da próxima geração do Google Tag Manager e do Tag Manager 360 para Mobile Apps,HTML,pt
4061646345741687296,O homofóbico dentro de cada um,HTML,pt
5398961846611538944,Hangouts para Android ganha opção de mensagens em vídeo | Google Discovery,HTML,pt
4313871021753083904,Startups matam. E suas vítimas são as empresas que ainda não entendem o que é a Economia do Acesso,HTML,pt
5940374562401786880,Visual Thinking and Learning 3.0 working together at Walmart.com | Happy Melly,HTML,en
3972616933829295616,Game On: 5 Global Mobile Gaming Trends,HTML,en
-583471248660258432,"De Zelotes ao ""projeto secreto de TI"": diretores do Bradesco respondem dúvidas do mercado",HTML,pt
-4412848927260591616,New Africa Trend Briefing from TrendWatching | BETTER TECH,HTML,en
7469361608711738368,Land Rover's lead engineer explains autonomous off-road driving,HTML,en
2633209697262372864,"Why Performance Matters, Part 1: The Perception Of Time - Smashing Magazine",HTML,en
4068119742428755456,"Why Performance Matters, Part 2: Perception Management - Smashing Magazine",HTML,en
-6504694273023533056,"Why Performance Matters, Part 3: Tolerance Management - Smashing Magazine",HTML,en
-4864344772765973504,Getting Ready For HTTP/2: A Guide For Web Designers And Developers - Smashing Magazine,HTML,en
882422233694040064,Infográfico: Algoritmos para Aprendizado de Máquina,HTML,pt
-6643406494673361920,Vendas da Netshoes crescem 267% em dispositivos móveis no 1º semestre - 24Brasil,HTML,pt
6412479507689487360,Microsoft's new online certification program kicks off with data science specialization | ZDNet,HTML,en
245828856632598560,Campaigns Are Dead. Modern Marketing Is a Data Exchange,HTML,en
-9176143510534135808,Livraria dá adeus a estoque e imprime livros na hora,HTML,pt
3799372021687456256,GIMP 2.9.4 Released,HTML,en
2727743992157210112,The Future of Digital Banking is Now,HTML,en
6858632230975271936,"Zendesk's ""Automatic Answers"" taps machine learning, AI to generate bot-style email responses",HTML,en
5658615529969625088,NES Classic Edition Coming This November,HTML,en
667643281369196288,Java Tools and Technologies Landscape Report 2016 | zeroturnaround.com,HTML,en
-2088615309014484224,UE não dá sossego ao Google. Novo alvo? O AdSense,HTML,pt
-5848755753905481728,"Incrível, Skype se lembrou que o Linux existe!",HTML,pt
-5009578843275173888,This $2.8 billion startup gets all of its daily meetings done in 10 minutes,HTML,en
3881851296308711424,Developing Android unit and instrumentation tests - Tutorial,HTML,en
1768976290984301568,Top 5 Android Testing Frameworks with Examples,HTML,en
2362495898257544704,How Do Top Android Developers QA Test Their Apps?,HTML,en
-5078536505040226304,Nintendo to Release Mini NES with 30 Pre-Loaded Games in November!,HTML,en
-1638122353599615744,Quem pediu mais um formato de cartão de memória? Ninguém? Eis o UFS!,HTML,pt
5233661737033380864,Desinformação (até do Senado) faz motoristas acenderem farol à toa - Outra Cidade,HTML,pt
-3351990231604537856,Carrinho de criança carrega seu smartphone usando geradores instalados nas rodas,HTML,pt
-1968251596393236480,Como o Facebook testa o impacto que a atualização dos apps têm na bateria dos smartphones,HTML,pt
464601875539492992,Apenas US$ 59: Nintendo anuncia o relançamento do Nintendinho com 30 jogos na memória,HTML,pt
607684800821303680,How This Former Google Engineer Is Bringing Blockchain to Banks,HTML,en
8863288680270589952,MG promove até dia 15 conferência sobre diversidade sexual e cidadania LGBT,HTML,pt
3799414975499163136,"Dropbox open-sources Lepton, a compression algorithm that cuts JPEG file size by 22%",HTML,en
-5702535287667979264,O raio-x financeiro das empresas fofas,HTML,pt
-8651474460024926208,Pokémon Go pode ser nova ferramenta de marketing | EXAME.com,HTML,pt
-9045753673721269248,BIG BRAND REDEMPTION | New free Trend Briefing from TrendWatching,HTML,en
-7570652411388242944,The compelling case to replace a 40-year old core system - Chris Skinner's blog,HTML,en
2736373711035411456,What exactly is a design culture? ,HTML,en
4865901874365409280,Coca-Cola Brasil entra no mercado de café,HTML,pt
539980615899429568,Mastercard lança rival do Apple Pay e reforma seu logo,HTML,pt
-8531951303518498816,Os 5 maiores desafios do Marketing em 2016 | EXAME.com,HTML,pt
-2211174111335280128,MOBILE TIME - Aeroporto do Galeão é o primeiro da América Latina a ter app com navegação indoor,HTML,pt
2551517430254714880,What Business Leaders Should Know About Swift,HTML,en
4597139024287190016,"Ava wants to molecularly replicate high-end wines, no grapes necessary",HTML,en
1283472251609674496,Conheça 20 atletas LGBT que vão competir nas Olimpíadas do Rio,HTML,pt
-1734960446580993536,A tougher Turing Test shows that computers still have virtually no common sense,HTML,en
5350829677696205824,2016 will be the year of conversational commerce - Chris Messina,HTML,en
-70211258489242440,Anaqueen Skywalker: um mashup de Star Wars com Bohemian Rhapsody,HTML,pt
2608740049979127296,Pokémon Go to go global 'soon' as hit game launches in three more countries,HTML,en
2051327203770554112,Visa traz pagamentos móveis ao Brasil junto com Samsung - Startupi,HTML,pt
-548976469460064576,Using Honcho to Create a Multi-Process Docker Container,HTML,en
-1596335233529956352,Why Kubernetes may be a bigger threat to Amazon than Google's cloud - TechRepublic,HTML,en
-7553931975579247616,Comercial japonês cria cidade de papel com caneta que conduz eletricidade,HTML,pt
123378787151399952,Como o Pokémon Go ajuda a explicar por que o Brasil é um país pobre,HTML,pt
7459643459148487680,Grupo de bancos adere à tecnologia do bitcoin em transações,HTML,pt
5533752987392101376,7 Questions to Ask Before Your Next Digital Transformation,HTML,en
-1564468014116140032,Automate Docker with the Remote API and Ruby,HTML,en
4106497696154898432,Learn Swift Programming Syntax | Udacity,HTML,en
-3619568065513202688,Quinzena tem a melhor venda diária do ano,HTML,pt
-6783772548752092160,Livro: Retrospectivas Divertidas,HTML,pt
5141088074002391040,Conheça o Relatório de Informações do Público Alvo do GA :),HTML,pt
2633033854118851584,Como o novo algoritmo do Facebook afeta sua estratégia de Marketing,HTML,pt
8622597251681699840,Walmart começa a recusar cartões de crédito Visa no Canadá | EXAME.com,HTML,pt
8297658253225035776,Final Developer Preview before Android 7.0 Nougat begins rolling out | Android Developers Blog,HTML,en
6492104262016302080,"Código Google: Provedor de segurança ""Crypto"" descontinuado no Android N",HTML,pt
3779434447835779584,"Hello, a nova rede social do Orkut, está liberada no Brasil",HTML,pt
-7891293130731329536,Sobre o Hipsters Ponto Tech,HTML,pt
-4718837078135183360,Strictly Enforced Verified Boot with Error Correction | Android Developers Blog,HTML,en
-4770861947600257024,Unilever Buys Dollar Shave Club for $1 Billion,HTML,en
4303142677581479424,Do Crows Hold Funerals for Their Dead?,HTML,en
-5527182266336855040,40 Basic Japanese conversations,HTML,ja
-8369610219380465664,Nintendo has doubled in value since Pokémon Go's release,HTML,en
-6076367233589223424,Android Developers Summer Reading List,HTML,en
-7627738093477170176,"Benchmarking: O que é, como surgiu e como fazer",HTML,pt
2480569770059008000,Git for Windows accidentally creates NTFS alternate data streams,HTML,en
-5491334714953807872,20+ Docs and Guides for Front-end Developers (No. 9),HTML,en
6304895356046683136,"Introducing Cloud Natural Language API, Speech API open beta and our West Coast region expansion",HTML,en
7734121175534200832,"""Consultorias promovem a desvalorização do nosso negócio"" - Meio & Mensagem",HTML,pt
2639926854188905984,"O que aprendemos com os modelos de gestão da Google, Netflix e Dell  Leia mais em Endeavor @ https://endeavor.org.br/modelo-gesta-dell-netflix-google/",HTML,pt
4259370161044254720,"How I built an app with 500,000 users in 5 days on a $100 server",HTML,en
6504364365389213696,Honda e Softbank desenvolverão sistema de IA para ajudar os motoristas,HTML,pt
-6192579321116251136,3 noções básicas essenciais para a criação de uma suíte de automação para aplicativos web,HTML,pt
-1006791494035379328,"Google unleashes DeepMind on energy-hungry datacenter, cutting cooling bill by 40 percent",HTML,en
2122245305662000896,Today in Apple history: iBook ushers in a Wi-Fi revolution,HTML,en
-2306981937763401216,[Dica] Passport Map Shows You All the Countries You Can Visit With or Without a Visa,HTML,en
-2059465483219605248,"[Free Online Course] Sit Less, Get Active - The University of Edinburgh | Coursera",HTML,en
